,User Ratings,User Reviews,Name,Overall Rating
58,4.0,"Went there last month for my birthday trip with family. Booked a family suite which could accommodate 3 adults + 1 child. Arrived at the hotel to find out that there’s only 1 bed in the room and the other “bed” had to be converted by pushing 2 sofas together. My 12 yr old son had to sleep there in the end as my younger daughter bunked on the king size bed with us. Tad disappointing. But the hotel made up for it with its spotless bedroom, great service (esp the bfast at club lounge) and the superb location. It’s only 3 mins walk to the BTS station which already had a huge mall linked to it. Saw another smaller mall while on the way to the station. Opp the hotel were a couple of decent Thai massage parlours which operate till midnight. Had a surprise birthday cake from the hotel on my birthday too! Will def return next time ! ",SKYVIEW Hotel Bangkok,4.5
59,5.0,"I should've just stayed at this place the whole time. I was in BKK for a month and moved around a lot. It was all downhill after staying here.Location is great, rooms are very nice, exercise room is very nice, food is very good, pool is very nice, the rooftop bar amazing...You can pay a lot more and get a lot less.",SKYVIEW Hotel Bangkok,4.5
60,3.0,"The hotel itself appears new and very clean. My room was great. I think it would be a very nice stay Sunday through Thursday. On the weekend, this place is over taxed.- Mojjo Rooftop Bar: ""Closed for private event"" A wedding reception on one of the top-floors; only having three fully operational elevators after 5pm it was a challenge to get to a restaurant, gym, pool or back to your room. -I tried ordering room service, I had to call back two times to finally get a deliveryI'll try the Hilton across the street next time.",SKYVIEW Hotel Bangkok,4.5
61,5.0,"My 2nd stay at Compass Hotel Bangkok this year. Very convenient location, near BTS station and shopping center. Friendly staff and clean room. Having a 24hour gym is perfect. Also there is a nearby 24hr convenience store. ",SKYVIEW Hotel Bangkok,4.5
62,5.0,"I would like to say thank you to all the receptionist, especially TIK and GREEN. When i reached the hotel and going to pay taxi, i could not find out my wallet which keeps all my cash and cards. I opened all the luggage in a great panic right in front of the hotel door. Luckily, GREEn and another staff calmed me down, paid me the taxi, called the shopping center that I thought I have lost the wallet. Furthermore, the hotel management team, ms TIK helped to check in the room without any payment in advance. All of them taked care of me while I was so worried. They actually closely follow up with the shopping center if there is any news. After taking a shower, luckily i found out the wallet right in my luggage at the bottom. Thanks Gods and thanks TIK for a good advise when I decide to stay at hotel to wait for news instead of turning back to the shopping mall which is waste of time and money. Thanks million to your flexibility and super super excellent service. My bad day turns into fanstastic day when I realise there are many good people around who willing to help. ",SKYVIEW Hotel Bangkok,4.5
63,5.0,Over all is. Ok very good. For hotel location close to bts phom phong the hotel very. Beautiful pool bar and. Root top bar. Good service from ms pae and lek they are very. Warm service and. Give us for goos view thank  a lot,SKYVIEW Hotel Bangkok,4.5
64,4.0,"A long overdue review. This hotel is pretty new in the soi 24 area. Near to malls, eateries & BTS.  The stay was comfortable. This was my 2nd stay in this hotel. Expected a bigger room for the price. Got a bigger room in the 1st stay.  Would like to mention Tookta, Chumpul & Pop for their hospitality. ",SKYVIEW Hotel Bangkok,4.5
65,1.0,"I had not been thinking that view was important to choose the hotel before visiting this hotel. Can you imagine? You cannot see anything even though your room has a big window. Only see the wall of the building which is very near from your room. I attached the picture I took..It should be notified before booking..If I had known that, I would 'not' choose this hotel definitely.I asked to change the room because of this terrible view, however the option was also not good-you can see dirty things on the top of building like old antenna.So finally I change the room with better view by paying additional charge..Terrible memories here...",SKYVIEW Hotel Bangkok,4.5
66,5.0,"Short break. Booked in today. 2 bed suite - lots of space, excellent facilities and well appointed.  Staff exceptionally welcoming, helpful, and pleasant.  Super location close to shops and transport links. So far - EXCELLENT!",SKYVIEW Hotel Bangkok,4.5
67,5.0,this hotel's breakfast is very delicious.and all people is very kind.Location is also good!!!! and hotel very near shopping and staff very helpful for help me booking spa especialy ms.khatthalee and reception thankyou and i will back here again,SKYVIEW Hotel Bangkok,4.5
68,5.0,It was my first time to travel BKK.I stayed for 2 nights and it was very comfortable :) Hotel was very cozy and clean!!!Also people were very kind. :)I will stay here next time too!!!!!Ms.tik and Aim were very kind too!!!!!,SKYVIEW Hotel Bangkok,4.5
69,5.0,"We stay in compass skyview hotel 4d3n in Oct 2019. Very nice location , only need 3mins walk to Emporium shopping mall and 5 mins to the bts phrom phong. They’ve good services and staffs are friendly and helpful  ! Yummy breakfast And many foods you can eat! ",SKYVIEW Hotel Bangkok,4.5
70,5.0,"Compass Skyview is a new hotel I decided to try when visiting Bangkok with my family (3 adults and a 7 yo child). The hotel is modern with good apartment like facilities and located very conveniently. It is a 2 minute walk from Emporium Mall, and a 5 min walk to Phrom Phong BTS station (door to door). Upon check in, we realized the photos shown on hotels.com were inconsistent with the reality of a 2 bedroom-connecting unit. The staff were very efficient and took quick measures to fix this issue with a free upgrade to a unit with the correct facilities. This was impressive to say the least, and i would like to give special thanks to the female employee who took the initiative to get this done. I was not in time to get her name unfortunately, but she wore glasses, had short hair, and could speak Mandarin. Special appreciation goes out to Khun Green at the Concierge as well - he helped me with delivering a package to my customer through a courier service. Khun Green was meticulous and carried out his job from start to end, with an update after. Thank you Compass Skyview, for having made our visit to Bangkok so enjoyable!",SKYVIEW Hotel Bangkok,4.5
71,5.0,"Hotel on a great location near Phrom Phong BTS, next to a mall was very convenient. Many restaurant and cafe near by. Hotel staff was so sweet set up a surprise for us in our room upon our arrival (Thank you!). 24 hour Fitnesses Center was my husband’s favorite. I had stay many other hotesl in that area. But I’m sure I will stay there again.",SKYVIEW Hotel Bangkok,4.5
72,5.0,"Centrally located, conveniently situated next to the subway and the mall, clean, courteous, friendly, fashionably appointed, an open air swimming pool on the 7th floor that wasn't crowded and very relaxing. Finally, the most pleasant surprise was my room has a free standing bath tube with view. Highly recommended.",SKYVIEW Hotel Bangkok,4.5
73,5.0,All is very very ok ok. Recommended it is closed to a big shopping mall and closed ti sky train station. All staff is very very nice to service you along the stay. I recommended if you want to find good hotel to stay in heart of Bangkok,SKYVIEW Hotel Bangkok,4.5
74,3.0,"hotel rooms are not fit for three bed!  our roll away additional bed was almost low to the ground.  not worth the price paid.  furthermore, our beds are too soft - add pains to the backhotel location was great and breakfast was also good  ",SKYVIEW Hotel Bangkok,4.5
75,5.0,The design of room is modern. Staff are extremely helpful and understanding. We were given very useful advice about what transport to take to reach the airport. We departed from hotel at 3am in the morning. The taxi was arranged with no delay. Thank you Skyview.,SKYVIEW Hotel Bangkok,4.5
76,3.0,"If you do not hope the sky view, you would not be disappointed.I expect a room in high floor, rather than an upgraded room in low floor.Many hotels in Bangkok, I will try other one in next time visit.",SKYVIEW Hotel Bangkok,4.5
77,5.0,"Stayed here during a business trip, with a late check in around midnight. Good location, 3 min walking distance from a BTS station, and there's a lot of good thai and jap food around the corner.Fitness centre was good, with a swimming pool, and don't skip on the breakfast if its include (it's really good!). Do control yourself to go and enjoy the delicious breakfast options nearby. The rooftop bar offers a good view over the Bangkok city.Stayed in the suite, and the room was spacious with a very good view. 24/7 amenities are nearby if you need anything.",SKYVIEW Hotel Bangkok,4.5
78,5.0,"This was a very nice hotel in Sukhumvit. It is extremely convenient to the skytrain. The hotel staff in the lobby and in the restaurants were all very friendly, helpful and welcoming. I very much enjoyed the breakfast, and it's great to have 24-hour room service available (super good spring rolls and cheesecake). The rooftop bar was beautiful. There are multiple restaurants and bars, including also at the lovely pool. My room was very comfortable and clean. The furniture, bathroom, and window view were all very nice. Wifi worked great. I was very happy that they also had a same-day laundry service.I am an English-speaking woman who was traveling by myself for work, and I felt comfortable at the Compass Skyview Hotel.",SKYVIEW Hotel Bangkok,4.5
79,5.0,"I stayed at the Skyview for one week whilst attending a conference at BITEC. The position of the  hotel is excellent  for Bangkok, a few minutes walk from a BTS Skytrain station. The club rooms have excellent views with ground to ceiling windows. I found the hotel very quiet and relaxing in a very bustling Bangkok. Nice swimming pool. Staff were very helpful , especially , Peary , Ice and Green. Excellent value for money. ",SKYVIEW Hotel Bangkok,4.5
80,5.0,Excellent room and facility with lovely service in every part of the hotel. Khun Pao and Khun Jan at the Front desk were so kind and helpful. The staff at Mojjo bar all so nice. We enjoy every moment during the stay. Thank you so much :-),SKYVIEW Hotel Bangkok,4.5
81,4.0,"We stayed at Compass Skyview Hotel for 7 nights. We got a great service from the staffs in the hotel, especially M. iB (HK) who made up our room very clean and made us stay comfortably. Thank you iB(HK).",SKYVIEW Hotel Bangkok,4.5
82,5.0,"I commend whole staff for service and effort to be best. I feel like best friend and only guest, but they treat all guests the same. Anko and AU and team are great, so are bartenders. Ice, Sun, Mook awesome, Kung very good service, she make breakfast time feel like vacation. Keep up the good service, you all make upper management look real good and organized.  khop khun krap.BJa",SKYVIEW Hotel Bangkok,4.5
83,5.0,"We stayed at Compass Skyview Hotel for 4 days in their Grand Executive room.We had great service from everyone in the hotel, especially Ms Ice who checked us in, whom was efficient and attentive to our requests.The room is clean, modern looking and has a great view overlooking Emquartier mall. The bed is comfortable  and we slept really well.The breakfast selection is decent and delicious.The location is superb, just a short walk to Prompong BTS station, and the 2 malls next to it.Overall, we enjoyed our stay at Compass Skyview, and will stay again for its value, service, location and comfort.",SKYVIEW Hotel Bangkok,4.5
84,5.0,"처음부터 Trin이라는 이름을 가진 직원이 친절하게 맞아주어 기분이 좋았다. 호텔의 위치도 매우 훌륭했고, 방 컨디션도 좋았다. 조식의 종류는 많지 않지만, 전체적으로 다 맛있었다. 수영장은 작지만 관리 상태가 좋았다. From the beginning, I was happy to have an employee named Trin warmly welcomed me. The hotel's location was excellent and the room was in good. There are not many kinds of breakfast, but they were all delicious. The pool was small but in good condition.",SKYVIEW Hotel Bangkok,4.5
85,5.0,"The services are still in excellent level, compare with my first stay at January 2017. Extremely close to BTS station. One of the best choice with the budget of 4000 bahts per night in Phrom Phong area. Will come again for sure!",SKYVIEW Hotel Bangkok,4.5
86,5.0,Fifth stay here and my go-to hotel in Bangkok. Exceptional stay and  wonderful hospitality. Thank you Pea and Pop for the impeccable service. Would definitely return!Swimming pool and gym were nice too!!!,SKYVIEW Hotel Bangkok,4.5
87,5.0,"This is an absolutely excellent hotel with absolutely exceptional service, in particular Pop and Pae at the front desk who were very helpful. Pop went above and beyond for us to ensure we had a pleasant stay. The roof top bar is a must visit at sunset.",SKYVIEW Hotel Bangkok,4.5
88,5.0,"Compass Skyview Hotel,perfect location beside with Phrom Phong station and Emquartier& emporium department store, and the Oasis spa offers free shuttle to thehotel. In addition,the room with bed are super comfortable more then 5stars, the hotel staffs are very enthusiastic to help, tks Mrs. Sa. Extra plus 32F Sky bar offers unbeatable views and is worth staying  again definitely. ",SKYVIEW Hotel Bangkok,4.5
89,4.0,Found hotel convenient with the BTS a few minutes walk away. The hotel is generally well maintained and clean. Rooms are adequately sized and offers a great view of the city. Breakfast was good and has good options. ,SKYVIEW Hotel Bangkok,4.5
90,5.0,"We checked into the sky club rooms which were really nice, spacious and comfortable. Went to the drinks and snacks evening and were really impressed by the quality of food they offered plus the drinks and cocktails were really nice. Sun and Cherry were very attentive and ensured we had a lovely time. Later we went to the sky bar for a drink and found the view quite spectacular. It’s great to look over Bangkok at night from above. The breakfast the next morning was more than ample and there was lots to choose from.  The chef cooked my eggs to perfection. Service here was again really good. Overall I’d highly recommend this hotel for all round experience. Thanks for a great stay.",SKYVIEW Hotel Bangkok,4.5
91,5.0,Location was excellent.  Next to Emporium Mall and other interesting sites. Breakfast was excellent and rooms were exceptionally clean with a god view of the city.  Gym facilities were up to date and well maintained.,SKYVIEW Hotel Bangkok,4.5
92,5.0,"This hotel have a very excellent location which takes only 5 minutes walk to the BTS station. On arrival, the hotel staff give us a warm smile and welcome drink. I want to appreciate one of the woman manger with short hair and glasses in the buffet restaurant, as she present a five star service to us. The water pressures inside the room that the hotel first assign to us is weak, we told that manager and she kindly arrange another room to us immediately. She even bring us to see the new room by herself. Overall, the service was fabulous and the environment is beautiful also. Hope to return this hotel during next visit to Bangkok!!!",SKYVIEW Hotel Bangkok,4.5
93,5.0,"Hotel is just next to Emporium and Emquatier shopping mall, very convenient. The lane outside hotel has many massage shops to choose. Staff were very helpful. Concierge staff were ready to make reservations, contact massage stores when requested.My special thanks to Tik, and her colleague who helped me stop bleeding on my finger, when I had a deep cut. Blood kept running out for 15 minutes! Tik even offered to change my dressing in the evening if I needed to. She came to me to see how I was when checking out the next morning. I really appreciate their help.",SKYVIEW Hotel Bangkok,4.5
94,5.0,"The hotel is very beautiful, good staff especially NaN, PiA and Phan where amazing. The staff at the reception where amazing. Good rooftop pool with nice view, rooftop bar was amazing with wonderful views. The Gym is 24 hours which was perfect for me so I could go wherever I want no matter the time . Nice buffet breakfast. don’t have a second thought. Just go ahead and book this hotel . One of the best in Bangkok ",SKYVIEW Hotel Bangkok,4.5
95,5.0,"When I have arrived, they welcomed me & my wife very warmly. Especially, Ms.Pea who arranged my booking was very kind & nice. She patietly explained the hotel.There are several shppong shops near the hotel & the its very near the BTS station.",SKYVIEW Hotel Bangkok,4.5
96,5.0,"stayed twice during a business trip to Thailand. Enjoyed everything one can enjoy in a hotel, the area was great, easy access to shopping, restaurants and the elevated train. The service at the hotel is impacable, the staff very attentive to all requests, rooms are extremely comfortable and the views from the top floors are great. Silver Lining club on the 33 floor offers great amenities, and services, please don't miss that.",SKYVIEW Hotel Bangkok,4.5
97,5.0,My friend and I stayed at the hotel about a month ago. The location of this hotel was great. We only booked the hotel 2 days ahead and we didn't even have time to exchange some thai bucks before I went. The hotel was right next to a mall that had a great currency exchange shop famous for reasonable / high exchange rate (superrich). The breakfast buffet there was not bad as well. The staff there were really well trained and provided exceptional customer service. The first person we met at the front desk was Pao HK. He is a very nice guy greeted us with smile. The room were clean and tidy. I would recommend my friend to stay at this hotel.,SKYVIEW Hotel Bangkok,4.5
98,5.0,Amazing customer service!! Definitely recommended ️Beautiful sky viewRoom has everything you need Food is delicious and they even have 24hrs room serviceClean and always smells freshVery safe and quite ask for chan she will definitely help you with any request ,SKYVIEW Hotel Bangkok,4.5
99,4.0,"New, well maintained hotel in a super location 1 minutes walk from emporium which was extremely helpful for us because we were travelling with a toddler, so it meant we could go back to our room in five minutes no matter where we were in Emquartier and shops/ restaurants/cineplex stone's throw away . Stayed in a suite. Suites were fine but felt a little bare although they had all the expected amenities. Adding some colour/rug/cushions and a few little touches of luxury/comfort could really take things up a notch, but this is not a criticism at all just an observation. Had a pleasant stay with good service. V decent breakfast and overall much better value for money than Emporium suites in my opinion if you are looking to stay in close proximity to Emquartier. Would stay again, especially given the unbeatable location. ",SKYVIEW Hotel Bangkok,4.5
0,5.0,"One of the most scenic rooftops in Bangkok is Vertigo, the place I choose for my birthday. The food is good, the view is incredibly beautiful, especially for sunset, moreover, the service is excellent, the staff, named Lek, treated us very well not only presenting the food but also taking us the photo. This place will be recommended to my beloved ones.",Banyan Tree Bangkok Hotel,4.5
1,5.0,I stayed in a serenity club room with stunning river and city views on the 55th floor (thanks for the room upgrade!). I’m impressed by the services. All staffs were friendly and helpful. The pool and the gym are quite small but nice. The hotel has an excellent rooftop bar. The overall experience was absolutely amazing.,Banyan Tree Bangkok Hotel,4.5
2,5.0,Mr.Lek was very helpful while we were dining. Best place to pick for special occasions. Great view. Good food quality. Luxury but low key. Classy is the definition. I recommend BKK Mojito for a starter.,Banyan Tree Bangkok Hotel,4.5
3,5.0,We came here to celebrate my birthday and the experience was amazing. Although it wasn’t our first time here but the service was exceptionally well today especially with Khun Lek as our waiter. He took great care of us to make the night special. The food was very delicious and overall would really recommend for any occasions to come.,Banyan Tree Bangkok Hotel,4.5
4,5.0,"great rooftop view in bkk ... dim light is perfect time for come with friend or your honey.. food so yummy!! Verity ! Nua toon lamyai , Beef steak and verity dessert! good service -K.Lak & K. Pear. ",Banyan Tree Bangkok Hotel,4.5
5,4.0,"We did a quick staycation at the Banyan Tree, and stayed in one of their club suites. There's a lot of positive things to say about this hotel. First, the location on Sathorn road makes it pretty accessible to things. The sheer size of the hotel, at over 60 stories is pretty impressive. And the rooftop bars and restaurants are really hard to beat. The views from the rooms, and from the rooftop venues is really quite exceptional. Overall the experience here is good. You shouldn't be disappointed with a stay here. The hotel interiors are beginning to look a little dated, though. Not because they are worn out, but just because design trends have changed, and newer hotels reflect those changes.",Banyan Tree Bangkok Hotel,4.5
6,5.0,"No words can describe how good my experience was on the Saffron cruise by Banyan tree and the level of detail and organisation from Jim who helped me to organise a surprise engagement proposal to my girlfriend (now Fiancé, she did say yes!) Jim organised everything for me, where the best seats were for the proposal (table 61 upstairs, on the top deck in front of the beautiful Wat Arun), arranging a bottle of champagne, Flowers and getting a book on the boat secretly so that my Fiancé would not know. From the moment we arrived on the boat the service was exceptional from our waiter First who was amazing from the moment we got on to the moment we left the cruise, we was escorted to our reserved table for a pre drink overlooking icon Siam and all the beautiful places along the river, then we was escorted down to the dinner table and a bottle of champagne was waiting. A massive thank you to the chefs also, the food was amazing, it was the best red chicken curry  we’ve had since being in thailand over two years! First our waiter then escorted us back up to our table to have our dessert, where the proposal took place, First and his team helped to film it and take lots of pictures for us to make our evening really special and one we will never forget! This is by a mile the best river cruise we have ever been on, it is pure luxury from start to finish, service, food, comfort, drinks was sublime.A special mention to Jim who planned and organised my whole engagement idea from the Banyan tree side and also to First who took some incredible photos of us and helped us the whole time and having to serve other tables. ",Banyan Tree Bangkok Hotel,4.5
7,5.0,"Since the 1st step to the bar ,awesome panoramic view skyline of Bangkok including friendly staffs especially K’Lek always take care of us during fantastic dinner moreover he always suggest the menu  that makes me so impressed. Well done!!!come back again for sure!",Banyan Tree Bangkok Hotel,4.5
8,4.0,"We’ve spent 3 days 2 nights here. We really appreciated the service from Khun Chay of Vertigo sky bar so much. He is very talented in service. He provided us with a great recommendation of food and beverage choice. Thank you Khun Chay for making our lovely dinner go beyond excellent.Apart of Khun Chay’s service, we have got room 1701 which really disappointed on the first night. Below points are what we found.1.We found pieces of broken glass in the cooler. 2.The steam room couldn’t be use. 3.The bathtub drainage was malfunction. 4.Safe box was not working.",Banyan Tree Bangkok Hotel,4.5
9,5.0,"Well service and taking care of us especially K.Lek. He gives a great service mind and takes the best photo of us as well. Furthermore, I love the every menu course esp Australian beef, Crispy duck salad. We'll back again in the next time for sure.  : D",Banyan Tree Bangkok Hotel,4.5
10,5.0,"We have a chance to dinner at Saffron cruise. The meal was soooooo good, if you love Thai food and a good Bangkok river view this is it.K. Banyat and K.Lek treat us very well!! The bangkok night view is perfect.We will come back again for sure.",Banyan Tree Bangkok Hotel,4.5
11,5.0,The Sky bar on the 61st floor is an absolute must see and unforgettable! Great atmosphere! Food and drinks were superb. I would like to give a special thanks to Khun Jackie (Concierge). You made my experience memorable. I highly recommend this place and I will definitely return!,Banyan Tree Bangkok Hotel,4.5
12,5.0,"I had such a fantastic moment there. I and my boyfriend stayed there for a night to celebrate my belated birthday. I got a spacious one bed suite with a very nice view of Satorn area. With all that, million thanks to Jacky at concierge  who took care of us perfectly when we arrived. He also had a perfect recommendation for a nice  place for dinner. That was one of the best experience I’ve ever had. ‘’ Impressive’’ ",Banyan Tree Bangkok Hotel,4.5
13,5.0,"My boyfriend and I went there for celebrate my birthday and it was such a good moment. We got one bedroom suite , the room was so clean and the bed is so comfy. The service was so perfect, especially Thank you the staff who took care us, Jacky, he provided a great service and information, went the extra mile and made sure that our stay was great. We were so impressed. ",Banyan Tree Bangkok Hotel,4.5
