,User Ratings,User Reviews,Name,Overall Rating
0,5.0,"I had such a great time at the Renaissance, great location, modern decoration, attentive staff.Breakfast buffet is one of the best I've had in Bangkok, great variety, even has some exotic fruits that others similar hotels don't have, executive lounge is also good, great appetizer options.Rooms are spacious, great amenities and very confortable bed. I can't wait to stay here again, I definitely recommend.",Renaissance Bangkok Ratchaprasong Hotel,4.5
1,5.0,"There was a hiccup with the room or suite which I was allocated to until the Room Director Rojana came to salvage the entire situation and turned my experience into a warmth and fuzzy welcome with her professionalism and she exuded a calm collected manner! However, it didn’t end there. I lost my mobile phone and everyone including the kind security checked the cctv helped me! I finally managed to retrieve my cell phone!I cannot Thank enough every staffs here in this Hotel for their patience, kindness and impeccable services from the Heart! They have even baked a chocolate birthday cake for my son’s birthday! My gratitude towards them cannot express with words alone! They have certainly taken the 5 Stars services from the Heart to a whole new different level! They can indeed stand toe to toe at any day, any time with any International 5 Stars Hospitality! Please Thank Rojana and her team of staffs- David  and Cindy too on my behalf! They are definitely an Asset to any Hospitality business they choose to work with!Eric Room 1827/6",Renaissance Bangkok Ratchaprasong Hotel,4.5
2,5.0,"My daughter got a surprise chocolates after check-in. Thank you to front office team for arranging the amenities. By the way, thank you to Khun Mew for arranging the reservation for us as well. Me and my family so joyful to stay here! I will definitely come back for sure. ",Renaissance Bangkok Ratchaprasong Hotel,4.5
3,5.0,"== People ==This is my 5th Marriott hotels in Bangkok, which is great for the overall services.I have great impression while the arrival, bell boy is proactive, and front desk guided me to the R Bar for check in (Club Lounge is temporarily closed for renovation). The club team is very attentive, K Ploy gave us very warm welcoming and the nice room arrangement. The whole process is very smooth. I would like to thanks for the Club Manger K One and her team, they take care of the club guest well, and handled the incident with prompt action and properly.== Room ==Thanks to the Club team arrangement, we stay at a nice Studio Suite this time. The room with high ceiling, thus even it a bit aged, you still fell very specious. The bathroom is see through and with a big window, also feel comfortable while using the it.Housing keeping team did a great job to give us comfy room, the most touched thing is they provided the nice toothpaste for our long stay when we told them we don’t want to waste the toothbrush by just using the toothpaste attached. Only concern is the sofa by side of the window, the surface may need some retouch, suggest to make it wider while the renovation, then it can be a great day bed in the room. == Facility ==Great thing is the fitness open 24hours, good for me to do the cardio in the early morning. Swimming pool looks nice, but didn’t have chance to use this time.== F&B==One of the best breakfasts of the Marriott hotels in Bangkok, admire the wide variety of the food, as well as the pastry corner, almond and chocolate croissant are great, but egg stations’ quality seems not consistent.",Renaissance Bangkok Ratchaprasong Hotel,4.5
4,3.0,You gotta love the location of the hotel-in the middle of everywhere in BKK. Nice and comfy bed. The amenities are not bad but not my favourite-too faminine. Super slow food at R Bar. The aircon in male’s locker room definitely needs to be fixed/deep cleaned. ,Renaissance Bangkok Ratchaprasong Hotel,4.5
5,5.0,Great services as always. Breakfast especially cheese omelette by Chef Roong is the best. Khun June at Flavor always gives you morning smile. Service and Refreshment at the club lounge is quite good when not so crowded. Food and services at La Tavola and Feiya are great. Recommend for a short break. ,Renaissance Bangkok Ratchaprasong Hotel,4.5
6,5.0,"I felt excited every time to come back to stay at this hotel as its exceptional friendly and nice staff made me feel welcome and special. It was just like I was back to meet old friends. One of the most enjoyable time while staying here was during the relaxing times in the lounge to enjoy great food & beverage, while chit chatting to staff. Apart from Kwan, Ploy, Aey, Chacha, Kevin, Chef Jack whom I was familiar with, this time I also met Khun Wan, the club lounge manager. She was so active and attentive to guests’ request that I had no surprise why the lounge staff were impressive. Although I had no chance to meet Min, who was able to please you with, not only the standard alcohol drinks, but also some special drinks from her mixing skill, her lively and smiling faces when she handed in her specially mixed drinks with proud remained in my mind. She even said that she would keep practicing her drink mixing skill more and more in order to make her guests smile with happiness. What a nice lady!On the checking-out day, I always think to myself that ‘wait for me and I will come back soon’.This property is highly recommended for travelers who looks for great place to stay in the centre of Bangkok with full of fantastic staff who is prompt to offer the second-to-none quality of services.",Renaissance Bangkok Ratchaprasong Hotel,4.5
7,5.0,The service in the hotel was polite & friendly. The room and beds were comfortable. And great location that easy to access anywhere in bangkok. Thank you to reservation team to make it fast and convenient for the booking as well as the front line service. Thank you very much and keep it up your good work !!! ,Renaissance Bangkok Ratchaprasong Hotel,4.5
8,3.0,"It’s my first time staying at this hotel. So I had a little expectation before going.The hotel is easy access from BTS Chidlom station with convenience stores nearby. Walking distance to Central World and Siam Paragon. My friend and I stayed at Deluxe room with club benefits from Marriott’s. Unfortunately club lounge on a high floor was temporarily closed for renovations so we spent time at ground floor bar instead. Luckily we still had some snacks to enjoy. The bed size is perfect and soft. The wild clear window can see througc bathroom is good for staying alone and couples lol. But the room was a little bit old for the electric stuffs, no USB and still need to use ight switch. Staffs are friendly and helpful but there were a traffic during snacks time at ground floor. The staffs were lack and seats were limited while guests were many. Breakfast was good. Restaurant staffs were friendly. It’s good that they serve orange juice with shot of espresso, well adjustment. Unfortunately I didn’t had a chance to try other restaurants in a hotel.",Renaissance Bangkok Ratchaprasong Hotel,4.5
9,5.0,"I stayed in the hotel during new year's eve. The hotel was extremely packed and the staffs are extremely busy with the guests. However, the staffs still able to deliver a top notch experience for me. The hotel is one of my most favorite staycation destination in Bangkok. This is not my first visit and definitely not my last",Renaissance Bangkok Ratchaprasong Hotel,4.5
10,5.0,"The promotional rate during Covid-19 was almost nothing so we didn't expect much at all. However, it turned out to be one of the best workation experiences. The check-in lady, Khun Dew, kindly upgraded the room the next day when it became available. We were greeted by first name with big smile by most staffs everywhere in the hotel. Our special thanks go to Khun One, Khun Kwan, and Khun Kevin who were always there especially around the club lounge. Khun One is highly professional, she manages the club lounge effectively with friendly vibes, making guests feel very much like home. Breakfast is one of the best in town. Loved the signature egg benedict with curry sauce. Must try! The afternoon tea and canapes times (rather think of it as late lunch and dinner), were always of high quality and tasty and it includes alcohol too! We also used the gym situated on high floor with the view of Bangkok skyline. I particularly like the pool because it is temperature controlled with heater. Will definitely return.",Renaissance Bangkok Ratchaprasong Hotel,4.5
11,5.0,"Just visited the hotel with a small group of friends, each of whom can be very demanding. Thanks to Khun Ning and Khun Ice, everything went smoothly and very enjoyable. I love how the staffers are very professional and keep things high standard, yet very friendly and easy-going. The overall vibe is quite young and trendy, too. No tux needed.",Renaissance Bangkok Ratchaprasong Hotel,4.5
12,5.0,Just got one comp night and chose to stay at this property for first time. The impression is staffs especially K. Tiffy and K.Ice at the front. My booked room type was unavailable as per previous guest's occupancy  when i arrived at 4.30 pm on 7th of feb but they upgraded me to 1515 with spacious area inside. Room cleanliness was top notch and bed was spotless. Love it! There were several kind staffs in lobby area but i dont know their name. There will be a second time of my visiting for sure.,Renaissance Bangkok Ratchaprasong Hotel,4.5
13,5.0,Well maintained hotel and excellent hospitality. Fell in love with the atmosphere in the lounge. I got a corner suite room which was very spacious and the view is fantastic. Wish I have a time to go back there again.,Renaissance Bangkok Ratchaprasong Hotel,4.5
14,5.0,"First time for stay in this hotel. Lobby area so classy and clean. Temperature check machine for Covid 19 are available make us feel safe to stay. Concierge and bellman at the lobby very friendly and active.Check in is very fast, thank you Khun Keng for provide us early check in and nice room for this time. Khun Pope, the operator staff very polite and helpful.Khun IK-Q staff at Fei Ya very good service and cheerful. We're very enjoy, happy and will definitely come back again.",Renaissance Bangkok Ratchaprasong Hotel,4.5
15,3.0,"This is my first time at Renaissance Hotel, Bangkok. I stayed there for 2 nights on 22nd floor. The room faces Central Word department store. The location is very close to sky train. Very convenient. Room: The decoration is nice, particularly the glasses which neatly used. The bed is amazing is very pleasant. The desk is also nice. The television is good. There are many channels. The toilet is beautiful. There is also a bidet shower next to the toilet. The bathtub is big and beautiful. It’s really photogenic. The amenities are good, nice smell. I really like the body lotion. There is an iron in the room as well. Well-equipped. Comfortable.Food: Delicious. Wide range of choices. Good quality.Service: Bell boy, and front desk boy are good. Housemaid are friendly. They gave me a very good impression. Very polite.Lounge: I went to check in on 21st floor at club lounge with a female staff. She did not greet me as a Marriott member. From my experience, when I check in any Marriott hotel, they generally greeted me by welcoming me back again. So, when she did not greet me like that, I was surprise; but that is fine, maybe she forgot. When I informed her about my booking, she looked nervous. From my experience, she did not perform a professional gesture at the check in desk. I did not tell me which room I was about to stay. When she finished the check in procedure, she did not inform me as well. So actually, from my experience, I expected more. I think this check in experience was not professional and unimpressive, particularly when compare to another Marriott hotel which I have stayed.At the lounge, on the day that I visited, there was a lot of people. I waited for quite a long time to get food. So I did not go back on the next day, because eating somewhere else was more convenient.Overall: Everything good, except the lounge.  ",Renaissance Bangkok Ratchaprasong Hotel,4.5
16,5.0,"The only hotel I been to that has a heated pool in Bangkok. Why would you need a heated pool in tropical Bangkok one wonders? The fact is there are indeed short sporadic periods of cold spells from November to January. This period, it went as low as 15 Celsius in my car’s thermometer on some mornings. For tropical folks here, jumping into a swimming pool in the cool season will throw many into hypothermia. So, when the pool is heated to a balmy 29 Celsius (as seen on my Garmin), it was indeed pleasant. As I swam over the water circulation outlets, it was like encountering those heated volcanic vents in the deep cold sea. The pool here is open air, but indoors in the shades. Lately, there has been a wave of Covid in Bangkok, strict measures are back in place again. To get access to the pool, we had to make advance bookings. Each booking is limited to 30 minutes. During that half hour, we had the whole pool to ourselves. Although this sounded restrictive, which it is, the experience was exquisite. Especially when you have children that are like 60,000W loudspeakers generating white noise, you do not really have to be concern about it as there are no one else around that could feel irritated. I loved the pool. It was like our personal family bathtub, minus the soap and bubbles of course.  The room we had was a one-bedroom studio suite. There are 4 on the corners of the floor we were on. Our room has generous windows across 270 degrees and that extended into the bathroom where a standing tub stood. A sturdy wall desk next to the large flatscreen, it was space slightly tight for some work I had to do. Natural light irradiated throughout the room, and the view of the urban scape was splendid. As the skies dusk, the spectrum of sunset tones painted our room. A sofa along one side, that was where I lazed relaxed and sipped coffee while watching the afternoon skies. Right beside this corner, a traditional set of gongs erected vertically on a stand. That was where I made loud chimes that did no rhymes, and probably irritating the rooms adjacent. The sound insulation between our room and the next 1726 was rather disappointing. No staff policed the floors on this Saturday night. The next room sounded like they had 20 people compacted in there to make the best out of the weekend room thay paid for. They were yakking loud, there was high pitch witchy laughter and there was constant slamming of the door as people went in and out of the party room. That really devastated my sleep. Fortunately, my child was able to sleep through all these. I only managed to get some shut eye after 1 am.  The executive lounge is located on a high floor. During cocktail hours, the place was entirely filled. This season, everywhere in Bangkok, everyone is a privilege guest with lounge access. And so, this is where we all turned cocktail canapes hour into a dinner meal. I love the way Renaissance practiced Covid measures here. We were not allowed to self-serve at the buffet line. But with the house being full, we had to wait long for our orders to be taken and waited equally long for the staffs to bring our food from the line. Children were at the verge of throwing tantrums. There was salad, there was karaage chicken for the children. There was the delicious panang pork curry and traditional rice crackers with meat sauce topping (except they kept forgetting to bring me the meat sauce). And then there was more. We really did not need dinner after that. Breakfast was an enjoyable feast as well. Except they were trying to freeze us to death. My congee turned into ice block, my pancakes turned into flying saucers. My child was unusually quite due to low body temperature and returned to live when I gave her hot food. Just kidding…  but it was cold. Breakfast spread featured local morning delicacies you find in markets. Moo ping (BBQ pork on sticks) was excellently tender and tasty. It was accompanied by sticky rice. There was kai yang kao niao (BBQ chicken, again with sticky rice), and there was also the traditional soy milk with dough fritters. It was local through and though. Some like it this way, bring the market in clean without walking the alleyways. Other then local, there was sushi, really delicious dim sum and all the other western spreads. They even had pulled-pork sandwich. I have always been impressed by the wide range in a Marriott buffet, but here at Renaissance, it was equally impressive. It did get quite crowded as 9 am drew near, so be early or be queued on weekends. We ate and ate, we did not need to have lunch, for the next 3 days.    Renaissance is located away from the main road. Seven Eleven will be a short stroll under the walkway of a shopping complex that has got a good sports factory outlet. On the main road up the stairs to the elevated walkway, you can easily reach Central World, the BTS and everything else. Convenience and access to everything are just short walks away. Outdoor areas for chilling out is limited in this hotel. Down the lobby, there are some chairs by the driveway, but that is the smoking area. The other outdoor space one could spend some time lazed on a chair to read a book is where the swimming pool is. And then there is the roof top bar, which is for drinks in the night, and was closed because of Covid. Any conducive space to do some notebook related work? No, there is none if outdoor one seeks. So, our room will have to be the work room, but with noisy child my concentration collapsed. There is a meeting room where the executive lounge is, but I would prefer sitting outdoors on a cool morning. All in all, my stay was fulfilling and fantastic, except for the noisy night. What was most unique and what I loved most, the heated pool. This shall be my return destination in the cooler months of Bangkok. And there are still some last chances of cold spells in Jan 2021 for the personal bathtub experience.",Renaissance Bangkok Ratchaprasong Hotel,4.5
17,5.0,The staffs were very supportive and friendly. The breakfast was so nice and delicious. Room view was excellent. The Italian restaurant provided good service and the quality of the food was great. Overall of the stay was fantastic.,Renaissance Bangkok Ratchaprasong Hotel,4.5
18,5.0,"Got room upgrade and extend check-out date as complimentary due to low occupancy during weekday. Executive lounge staff Khun Min was so nice. She noticed that my friend just reached the lounge nearly the closing time. Due to her kindness, she came to inform my friend taking some food before closing time. Even it’s little thing but big touching of our heart. Actually, all executive lounge staff is so professional, enthusiastic and active. We had a pleasant stay at Renaissance Bangkok Ratchaprasong.",Renaissance Bangkok Ratchaprasong Hotel,4.5
19,5.0,"Staying at the Renaissance Bangkok Ratchaprasong Hotel for 5 consecutive nights, we had so many great experiences there. The hotel is conveniently located in the heart of Bangkok. There are plenty of shopping malls nearby such as the Central World; where my wife went for her figure skate practice almost everyday and the Gaysorn Village is less than 5-min walk. And, the hotel is connected to the BTS Chitlom station via the Maneeya building on the 3rd floor. There are not so many guests during our stay so the hotel's quite peaceful and private. The 25 meter city-view indoor pool is a must to try. The fitness center is fully equipped with treadmills machines, and free weights, very impressive. We would recommend the La Tavola italian restaurant for dinner, the Parma ham pizza and their signature Tiramisu are mouth watering. Also, the famous Feiya chinese restaurant is always the best in Bangkok. Please try Peking duck and Dim Sum for lunch. Furthermore, we loved the wagyu beef burger atthe R Bar, so very yummy. We got upgraded to the Renaissance Suite room which is huge, beautifully decorated, and the bed and pillows are very comfy. We enjoyed the large sized bathroom, bathub with million dollar view. All the staff gave us a very warm welcome and best service since check-in; from Bellperson to Front desk. Moreover, we'd like to convey my sincere thanks and appreciation to Khun Cyndy, Khun Tuk, and Khun David for their kind assistance reserving and upgrading the room, and making sure that everything's alright for us during our 5-night stays at the hotel, especially the lovely yummy cake for us, we appreciate your thoughtfulness. They all surely have a top-notch service. We're looking forward to coming back to stay at the Renaissance Bangkok Ratchaprasong Hoteagain.",Renaissance Bangkok Ratchaprasong Hotel,4.5
20,4.0,"Currently, the hotel offers some of the best deals in a town, so that’s why we are here. The room we stayed was nice, quite big, with a large and wonderful bathroom. We didn’t went for the club room in the first place but then we decided to go for the Happy Hour (just a little additional price) and I have to say it was beyond our expectation. The food was even better than some other hotel’s lounge in a normal situation but the drinks may be so-so, but hey for this kind of price and situation it’s the best. For the breakfast, it seemed like the breakfast is served in the lounge in weekdays. There was something I would say “limited” about the food lineup but the taste was good. Pool area was fine. The services were nice. ",Renaissance Bangkok Ratchaprasong Hotel,4.5
21,5.0,"Great service, It is my third times here reception staff recognized me since I walk through the door entrance, They said "" Welcome Back"" and their duty manager greeting me with a full name "" Welcome back Khun Khantaphon"" such an impressive moment The room was located on the almost highest floor with a great city view and all facility in the room",Renaissance Bangkok Ratchaprasong Hotel,4.5
22,4.0,"The air conditioner is uncontrollable, the room service person had come to the room, but could not solve it, until the next day, another technical team came and founded it was a big solve,  anyway, the hotel is quick response and propose us the reasonable compensation by changed new room and late check out to me",Renaissance Bangkok Ratchaprasong Hotel,4.5
23,5.0,"Swift check in and check out process, everything was provided as per requested before arrival (well done Khun Mayple!). Khun Tony who accompanied me to my room after checked in by the Lovely Chinese DTA were friendly, Khun Boom front front door were very helpful,unfortunately I didn't remember anyone else name due to over excitement off having to spend time here.Room were spacious (Room 2001), cleaned, well maintained and had splendid view even in the bath tub, you can look out catch view of Central World.Fei ya Chinese restaurant-  duck is ever so soft and tasty. Even though it was a short stay, I made good use of the facilities: Steam, Sauna, Pool and Gym.Centrally located, short walk from BTS Sky train and the major shopping district.Exceptional service from all staff from Front door, Housekeeping, Fitness, DTSA, Engineering to F&B. I can’t wait to come back here, if the hotel will have me that is. ",Renaissance Bangkok Ratchaprasong Hotel,4.5
24,5.0,"I and my wife stay here many times within these few months. Check-in and check-out is very easy, quick and effective. Good job for K.Miew, K.Tong and their team.Service here is fantastic both housekeeping team and staffs in club lounge eapecially K.Ploy Breakfast is what I could not forget to mention. There are a lot of choices for breakfast and all dishes are great. Quan Spa is also great value and service. Thai Oil Massage is a must try.Only 1 thing that need an improvement is service from staff in Feiya. Overall stay is impressive and would definitely return soon, except Feiya Chinese Restaurant.",Renaissance Bangkok Ratchaprasong Hotel,4.5
25,4.0,"close to business area, including the BTS station. very good service and affordable price. I went Lumpini Park for morning run. it's 1 km from hotel. You may try the fitness room and the swimming pool at the hotel for the rush day. Central World and many shopping mall is closed to the hotel",Renaissance Bangkok Ratchaprasong Hotel,4.5
26,5.0,Second time stayed in this hotel. Location is flawless as the hotel is located right next to Chit Lom BTS station. Staff are excellent! Everyone i met was so generous and they sincerely did their  service from their heart. Thank to Tony Navigator helped me a lot. Room is a bit outdated but well maintained. The bathroom is so spacious that it’s like you can dance in it without hitting any wall. This hotel is definitely great top selection to keep staying  next time,Renaissance Bangkok Ratchaprasong Hotel,4.5
27,5.0,"I’m so impressed with the services here from various functions. Khun Min, Khun Kwan, Khun Nan and Khun Ploy at Executive Club are excellent. The young ladies are so nice and give us such an outstanding services. Khun Roong who is the chef at the breakfast room also superb. She gives me such a special services. Strongly recommend staying here.  ",Renaissance Bangkok Ratchaprasong Hotel,4.5
