,User Ratings,User Reviews,Name,Overall Rating
11,3.0,"We had to fly down to BKK for dental appointments and stayed at this hotel  Being an Accor Silver member and needing nights.Check In and Check Out was quick and efficient.  Though I did do the online check in.As most people know tourism is dead due ... Well I shall leave it at that. We were upgraded to room 1701 on both stays.  Room was nice.  Had lounge chair, Comfortable bed. Very hot water. Plenty of towels and amenities.BUT were it missed the mark is in two specific items. And if anyone from the hotel is reading this THEY DO NEEDED ATTENDED TOO.Safe?  Does not work.  Dead as a door nailShower head?  Way past its sale date. Water goes in every direction but down. A pure pain to take a shower.On the 2nd stay I decided to include breakfast.  The Square restaurant, from memory, has been renovated. It is much nicer and open.  Selections are minimal due to Covid-19 but there was enough choices.Would we stay there again?  Probably. Great location",Novotel Bangkok on Siam Square Hotel,4.0
12,5.0,"The hotel is located very near Chulalongkorn University, so it is the best option for a nice stay during the commencement ceremony. The staff were polite and supportive. Although this was the first time I spent at Novotel Siam Square, I got an upgraded room from superior room to executive premier room. This made our stay so memorable. The executive premier room was on the premier floor and had a very nice city view. The room was very clean and convenient. The hotel housekeeping staff were also friendly.",Novotel Bangkok on Siam Square Hotel,4.0
13,4.0,Had excellent service from staff at Gourmet bar and with a good band ( A Coustic Jam ) it made a good relaxing evening. The band had good range of music and will take requests.So if you like a relaxing evening this is a good place to come,Novotel Bangkok on Siam Square Hotel,4.0
14,5.0,Our stay at Novotel Siam Square was very comfortable with exceptional attention from all staff.I particularly appreciated Guest Services Manager Khun Thapakorn Nukerk’s friendly and thorough attention to our stay upon checkin and throughout our visit.Best location in Bangkok and very quiet.We will be back!,Novotel Bangkok on Siam Square Hotel,4.0
15,5.0,"We originally booked for 6 nights; however, we like it so much that we have so far extended for an additional 4 nights.  The Novotel staff are extremely nice, and Soft (นุ่ม) is the best of the best.  She is always so friendly and cheerful that I always make it a point to swing by Reception and say hi to her.  Gift (กิฟท์), Piichy (พีชี่) and Tah are are also friendly and cheerful with us as  well as others whom I don't know their names.  Michael, the Resident Manager, is doing an excellent job and it shows.  The location of the hotel is fantastic.  It is about a 2-3 minute walk to the Siam BTS and a 3 minute walk to my favorite shopping mall in Bangkok.....Siam Paragon.This is the 3rd time I have stayed here and each time I have had an excellent stay.   I plan on staying here again in March for the Green Day Concert at Impact Arena.David Klein......Accors Member",Novotel Bangkok on Siam Square Hotel,4.0
16,1.0,"Staff said room with upgrade for new renovated but he forgot to tell me about ugly view that can see disgusting roof and disgusting food chimney!unfortunately, room is not new just simple and nothing nice. ",Novotel Bangkok on Siam Square Hotel,4.0
17,5.0,Last night i had a wonderful dinner with my friend during heavy raining. Very excellent for location. It's very easy to meet my friend even heavy raining because of closed BTSVery good service and good take care from Ex Chef. I cant remember his name but he is a very good service and come to ask us about the food.The staff is very sevice mind as well.One nice place to meet up friends and recommend!,Novotel Bangkok on Siam Square Hotel,4.0
18,4.0,"During these months of being stuck in Thailand due to travel restrictions, i visited Bangkok several times. I needed a conveniently located hotel at walking distance from major shopping malls, also a place not too far by taxi from Embassies on the wireless road,. I chose the first time Novotel on Siam because of the location but then i went back several times for the quality of service the beautiful room and efficient Gym and an incredibly courteous, efficient staff crew. the only reservation about ti i might have is that during the months of COVID 19 rates have been very low. If I were to pay full price I might define it a bit overpriced overall",Novotel Bangkok on Siam Square Hotel,4.0
19,3.0,"We stayed in this hotel because we are a loyal ACCOR Hotel member and because my typical teen daughter wanted a ""shopping"" birthday spree at Siam Square.  Since it was our FIRST TIME in this hotel, we initially booked for 1 night, because we really didn't know what to expect. But..... because the hotel rate was inexpensive, we stated our intentions to the FO Manager during check-in of staying for an additional 2 to 3, depending on my daughter's wishes. Apparently,  we only lasted ONE night. ON-CALL, BEFORE CHECK-IN:3-STAR- I reserved for a room via phone call. That went smoothly and hassle-free! - I asked if we could request a surprise birthday cake for my daughter. The receptionist said they couldn't give us one, even if we paid for it since they needed a 3-day notice. - The receptionist however hinted that they could arrange a birthday surprise when we were already there. - BUT, NOTHING.  Sad.CHECK-IN: 3-STAR- NO welcome drinks. - NO greetings. - NO smiles. - A staff was whispering to another, as though (from an outsider's POV looked like she was ""gossiping"" or not.  - Another lady had a mask but was dangling it from one ear.  ️️THE ONLY PERSON WHO MADE A DIFFERENCE was The FO Manager, Khun Ja. She was very accommodating, gave the proper guidelines on the wifi usage, room no., breakfast time, etc. She also spoke very good English. Sadly, she wasn't present when we checked-out.WIFI:0-STAR -We tried using the wifi, and attempted on several devices BUT RECEIVED ZERO CONNECTION. Junior Suite ROOM:4-STAR- LARGE and LOTS OF SPACE!- has an iron stand and iron- blowdryer- basic toiletries- 2 bottles of FREE water - loved the lighting- 2 large TV sets- very soft sofa bed that we converted into a bed! - loved this!- loved the 2 large chairs!!!- 1 small working desk- safe- 2 pairs of slippers- 2 bathrobes- tons of towels - loved this!- doorbell*Perhaps a center rug may look nice on an almost empty-looking space would do the trick.HOUSEKEEPING:5-STAREXCELLENT! Very quick to respond and very friendly. - I forgot to wear my mask outside the room - a housekeeping staff reminded me in the most friendly and respectful way. - I requested for an extra pillow - received 2 pillows instead, so was rewarded with a generous tip from my husband. BREAKFAST:3-STAR- We were greeted with words and WITHOUT a smile. - We gave our room no. and we ushered ourselves inside since we weren't guided. - No big deal though, since there weren't many inside the restaurant.- The staff were very friendly towards each other, we even saw the Restaurant Receptionist walk hand in hand (fingers interlocking) with the Chef (wearing a black top)- I smiled at all of the staff, who I encountered only to receive blank stares. - Again, no big deal. Maybe, they weren't trained to smile.  And, they were obviously, busy. Except for a lady named ""Khun Pump"" who smiled at everyone and was busy paying attention to all the ""foreign"" looking guests, except for my family who looked very Asian. ️️The ONLY man I would like to commend was the man who had a stroke. HE WAS THE ONLY MAN WHO KEPT A SMILE ON HIS FACE AND WAS ATTENTIVE, DESPITE BEING VERY BUSY!!! Despite the fact, that he only had one active hand (since the other hand had decreased strength and dexterity due to your stroke), he was actively pacing back and forth, making sure that all the areas were clean, checking the food, cooking and cleaning countertops. HE SHOULD BE GIVEN A SERIOUS RAISE!!!! POOL:4-STAR- A very large pool!!!! - My kids and I were happy to have done a lot of lapses here. - Very Very Clean!- OFF POINTS: the pool bar is close, the pool is not ""new' - But, who cares, t'was very very clean!!!  HAPPY-HOUR at the LOUNGE:5-STAR- FREE FOOD and DRINKS!!!- UNLIMITED: Garlic Mussels, Chicken Nuggets, and Fried Wonton Balls- FREE-FLOWING: Pineapple Cocktail and Beer- The Filipino Musicians were awesome! - They received a generous tip from my husband. - The waiters were attentive, warm, and informed us of the ""last call"". - Their awesomeness was rewarded with again, a generous tip from my husband. LOCATION:5 stars!!CLEANLINESS:5 stars!!!LOBBY LOUNGE:5 stars!!!ROOM:4 starsPOOL:4 starsGYM & SPA:didn't pay those a visit GUEST RELATION:3 starsFRONT OFFICE RECEPTION:2 starsDO I SEE THIS PLACE AS OUR SECOND HOME?- Not yet. - Though this place is a far cry from our very loved MERCURE (a hotel we've been going to for the past 10 years), it may still be worth another try. Let's see!!! I WILL DEFINITELY WRITE ABOUT IT AGAIN!!! WOULD I RECOMMEND THIS PLACE?- I would actually since I believe that this place may still improve and the location is a plus!",Novotel Bangkok on Siam Square Hotel,4.0
20,5.0,The hotel staff is very helpful and friendly. The location is in the centre of Bangkok. Variety of food for breakfast but the taste could be a little bit improved. The hygiene is up to standard for COVID-19. ,Novotel Bangkok on Siam Square Hotel,4.0
21,5.0,,Novotel Bangkok on Siam Square Hotel,4.0
22,3.0,"Our stay here was disappointing. The hotel appears to be of a high standard based on pictures posted online, however some of the rooms are dark and dingy, and in need of refurbishment. Some floors are still smoking, which added to the dingy feel. We hated our first room so much that we paid to upgrade to a refurbished room-  and even then I found the general state of these better rooms to be shoddy with broken fixtures, bad refurbishment and patch jobs. The workmanship didn't seem up to the usual Accor standard.The hotel is located in the busy siam square area, surrounded by plush malls, so excellent for high end shopping and restaurants.",Novotel Bangkok on Siam Square Hotel,4.0
23,5.0,"This hotel has excellent location and premises. Rooms are big and clean, and staff is very professional and helpful. Hotel has good quality pool with all day sun shine and spa services.  Breakfast buffet with lot of choices.",Novotel Bangkok on Siam Square Hotel,4.0
24,5.0,Great location. Novotel Siam Square is always my most favorite hotel in Bangkok. Very convenient to connect through Bangkok’s destination. Easy for shopping also you can experience with all highlight restaurant especially White flowers restaurant; Thai local food. This is the best Thai food for me. So I can said this hotel is valuable price good location and great service,Novotel Bangkok on Siam Square Hotel,4.0
25,5.0,"I have stayed at this hotel for my annual trip to Bangkok for FIVE straight years, simply because it ticks every box for me.First: it is smack in Siam Square, which is bright and busy and safe; with ample restaurant and shopping options; and a hop and a skip from the Siam BTS Station -- with links to practically the entire city.Second: the staff are just lovely. ALL the staff, from concierge to restaurant to tour serviced to housekeeping -- every single one will bend over backwards to help you. I have turned up way before check-in time, departed way after check-out time, and if a room is not available they always provide somewhere to shower/freshen up; and the lobby sitting area is wonderfully comfortable, with isolated cosy spots that allow comfort and privacy.The rooms are well-appointed and comfortable; with complementary drinking water and tea+coffee makings; kettle and blowdrier.A a female travelling alone, the safety of the area and ease of commute are big deals for me.  The BTS links to the Airport Rail line, and you are literally from the hotel check-out desk to the airline check-in desk in one hour. There is lots of shopping in walking distance, and a world of eating options.  Taxis are very easy to get in the area, as well.",Novotel Bangkok on Siam Square Hotel,4.0
26,5.0,"I arrived at Novotel Siam Sq on 13 Mar 2020 for a short getaway with my family of 3.We were served by Ms Gift who was polite and competent. Though the usual chk-in time is 2pm, she swiftly settled our check-in at 10am. We didn’t have to loiter around the hotel area and could freshen up before we went for early lunch.Another special mention was the touch of empathy on their customers. We were supposed to leave on 18 Mar 2020 but due to the border restrictions imposed by my home country due to the covid-19 outbreak, we had to shorten our vacation and leave 2 days earlier than scheduled. The concierge helped us to contact the airlines and tried their best to resolve the matter. Though their attempts were unsuccessful, I appreciate their gd efforts. Just before we left for the airport, we were also impressed by the hotel’s gesture of placing some croissant, danish juices and hot beverages for guests who have to leave earlier than hotel’s official breakfast time. We didn’t have to leave with empty stomach at around 5am in the morning. Novotel Siam Sq has always been my choiced accommodation when I’m in BKK. It’s not just the excellent location of the hotel, but the policy of child under 16 stays for free and the thoughtful touches the hotel has for its guest.I recommend stay at Novotel Siam Sq anytime! Keep up the good work! You guys deserve a pat on the back!",Novotel Bangkok on Siam Square Hotel,4.0
27,5.0,We were warmly greeted by their friendly staff by the name of Gift and she kindly upgraded our room. Check in was swift and location is right at the heart of Siam square area. What a nice surprise and thank you!,Novotel Bangkok on Siam Square Hotel,4.0
28,5.0,"The location is convenient, rooms are spacious and overall service was great, especially front desk staff Toktak and Milk.  They were very attentive and welcoming with their warm smiles.Would love to plan my next visit here again!",Novotel Bangkok on Siam Square Hotel,4.0
29,5.0,"Beautiful establishment, loved the hotel . Very clean rooms. Service was exceptional. Location very nice and close to all shops and restaurants. Very convenient location, easy to get too . Very clean. Service was extremely good. Staff very polite and professional. Breakfast buffet was amazing. Restaurant inside was beautiful. Rooms were ready on time. Staff very accommodating. Train stations minutes walk. Would definitely stay there again .",Novotel Bangkok on Siam Square Hotel,4.0
30,5.0,"I was extremely delighted with my last week stay in Novotel Siam Square.  From the concierge staff, to the receptionists and the house-keeping team, they offered heart-felt and attentive services with professionalism. To my very pleasant surprise, my room was well decorated with welcoming kits and message in appreciation of my loyalty. I am particularly impressed with the hand written welcoming card with elephant drawing, not forgetting the beautiful painting of Siamese mermaid on the mirror. The room was maintained at exceptional conditions and fresh with a bouquet of fresh flowers that made my day. Because of these extra miles effort in elevating my enjoyable experience staying in Novotel Siam Square, no doubt I shall keep coming back to this fabulous hotel - thanks and kudos to all hotel staff.",Novotel Bangkok on Siam Square Hotel,4.0
31,4.0,"Novotel on Siam Square was a convenient location, centralized, having BTS and OneSiam Shopping Malls all within walking distance. The room and bedding were exceptionally clean. Bell staff was very helpful from helping with luggage to booking a taxi to the airport. Front Desk staff was professional and knowledgeable, making checking-in and checking-out a breeze. The hotel's breakfast was simple, great for a quick bite, but more flavorful foods can be found elsewhere. I made the reservation last minute and perhaps it was why the view from the room was not great. Overall, wonderful hotel with great service. Don't stay in rooms ending in 08, they face anugly wall, with half a view of Bangkok's skyline.",Novotel Bangkok on Siam Square Hotel,4.0
32,5.0,"This hotel has a very cool lobby! Check out the swings in the lounge area....Breakfast was not included and pricey, but the best we had on our entire trip. The rooms are stylish and very updated , that being said they aren't huge. The location is near the skytrain and all the mega malls.",Novotel Bangkok on Siam Square Hotel,4.0
33,5.0,"I have stay in this hotel at least once every 2 mths for the past decade. The location is perfect with a BTS interchange, the hotel went through a decent retrofit and the staffs are great. AND Mr BEN, the manager, is exemplary. He hold impeccable service and it people like him that make a hotel stay awesome!",Novotel Bangkok on Siam Square Hotel,4.0
34,5.0,"The hotel was very kind to have my room complimentarily upgraded to a deluxe room. The room was newly renovated and clean unlike all the bad reviews that I have read before my stay. The hotel location is superb as it was stone throw away from everything you need. Most importantly, the front desk agent, Poh, shown an exemplary customer service. She was very helpful and cheery while doing our check-in and check-out.",Novotel Bangkok on Siam Square Hotel,4.0
35,5.0,"Despite being absent for over a year I was welcomed as a friend with many staff remembering my name! Kuhn Fon, Mam, Vi and so many others are a credit to the hotel. Great rooms fabulous location - would thoroughly recommend",Novotel Bangkok on Siam Square Hotel,4.0
36,3.0,Stayed 3 nights here. Good location as near Siam Paragon Mall. Rooms were clean but somewhat dated with old murals on walls. Breakfast breakfast buffet was fine and it came with room. Went to the Gormet bar to order a made to order sandwich which they advertise on the menu wall. Two times I was told I could not have made to order but choose one of two premise ones that looked old and did not have the ingredients I was wanting. Walked away both times disappointed. Don’t advertise it if you can’t deliver it. Other than that it was ok. Staff helpful. ,Novotel Bangkok on Siam Square Hotel,4.0
37,5.0,"Front desk staffs Ms Tok Tak and manager Toey were very kind and help me out with my very early morning check in. Thanks a lot for your hospitality. The room is spacious, hotel well located near train station and shopping malls. ",Novotel Bangkok on Siam Square Hotel,4.0
38,5.0,Very good hotel with amazing service great people just like the pictures and right in the center of everything with 4 minutes to Siam paragon mall and beautiful pool gym and spa and has a great view .,Novotel Bangkok on Siam Square Hotel,4.0
39,4.0,"Hotel was in a very good location; walking distance to lots of shopping malls. Starbucks and 7-11 just across the street. Lots of foot massage places available; fruit stand nearby.Hotel said it was newly renovated but already felt tired.  Minimalist and simple hotel room.  Honestly, breakfast was disappointing for the price and Bangkok expectation were high- was simply not met.  Furniture was very bulky so it was tight walking to the buffet.  Not very enjoyable.All in all, great location and good nights sleep. ",Novotel Bangkok on Siam Square Hotel,4.0
40,4.0,"Near shops and restaurants but inconsistent services as I did not get face and hand towels the second day and limited amenities.. like ironing board, iron and apparently there were no room service, a little surprised if you need some late night snacks..  At 15 floor, there were loud noises from mid night to 4-5 am as well as unusual loud noises outside the room at early morning.. sleeps were really deprived.. made it hard for early meetings.  ",Novotel Bangkok on Siam Square Hotel,4.0
41,5.0,"Warm welcome upon arrival at the hotel and Ms.Gift, the receptionist was excellent and helpful on advising us on the locations nearby. Our stay was fantastic and we will definitely come back again. Hotel is at a strategic location and very convinient to move around by foot",Novotel Bangkok on Siam Square Hotel,4.0
42,5.0,"Very good and excellent service by Toktak! Very kind and helpful Good location, near Shopping centre located at Siam. Easy access to shopping district Nice ambience and hotel. A warm and welcoming experience ",Novotel Bangkok on Siam Square Hotel,4.0
43,5.0,"My partner and I celebrated our anniversary in BKK and we decided to choose this hotel due to the good reviews and location. Needless to say, we were not disappointed. Front desk staff were friendly and welcoming. They never fail to greet us with warm smiles whenever we return to the hotel. they helped us with our itinerary and on the last day, they helped us book our ride to the airport which saved us quite a bit of money. Would definitely choose this hotel if I decide to visit Bangkok again. ",Novotel Bangkok on Siam Square Hotel,4.0
44,5.0,"I stayed first time at this hotel. I vow the location of this hotel! In the “heart of Bkk”. Many shopping malls are nearby. Very very very helpful and kindly stuff, especially lady on reception Giff ! Not bad breakfast;) Value for money ",Novotel Bangkok on Siam Square Hotel,4.0
45,5.0,"Stayed for 3 nights. Hotel enjoys a great location in city centre, you can access all highlights quickly. The rooms are very comfortable and the aircon excellent. The breakfast is excellent with lots of choice. The best feature of the hotel however are the hotel personnel - friendly, professional, couldn’t do enough to make our stay memorable.",Novotel Bangkok on Siam Square Hotel,4.0
46,5.0,Fantastic location in the central hub of city and excellent service. Food wonderful and great help from Thomas & Jay. Tour desk ever so helpful with recommendations...we even mastered the BTS Skytrain. Pool a great help to cool down after a day of exploring!,Novotel Bangkok on Siam Square Hotel,4.0
47,5.0,"In Novotel for a night, great band playing some fantastic music. Made the bar very enjoyable.Decided to stop in the bar whilst waiting for a friend to get into town for dinner plans and had the pleasure of being approached by the hand after their set, lovely chat and very friendly. New in town but hope they stay!",Novotel Bangkok on Siam Square Hotel,4.0
48,5.0,I have stay in.this.hotel and this hotrl.is the best location in bangkok. The staff Mr. Top was very nice and.professional. He made my trip unforgettable. And Ms. Jess always has beautiful smile. And Mr. TAR Abiigal Andrian. I will come back again soon.,Novotel Bangkok on Siam Square Hotel,4.0
49,5.0,"Wonderful location, only a couple of minutes walk away from so many fantastic shopping places, and surrounded by so many good eateries and massage places.The service here is also excellent. Tizz at the reception was exceptionally helpful in making arrangements to suit the needs of our stay. It is such service you find at novotel that keeps you coming back, holiday after holiday, year after year.My mother and I thoroughly enjoyed our trip, and we’ll be back again soon!",Novotel Bangkok on Siam Square Hotel,4.0
50,3.0,Great location it just located across Siam Paragon. You can enjoy food no matter local or international around the same area. Pool is nice. However the room is not as expected and we need to clean my room ourselves as the carpet has too much dust. Lastly I have to say thanks for the reception because my booked car didn't come but I was hurrying to airport. Their reception provided me their car immediately. Much appreciated!,Novotel Bangkok on Siam Square Hotel,4.0
51,5.0,"The location is unbeatable, step out into Siam Square with Siam paragon , Siam BTS , a bit more to mbk , central world and platinum. Food massage shopping all surrounding the hotel for all pockets. Add to this the amazing butler- like service of Tizz, who really dedicated his time and kind attention to my mother, sister and myself, addressing all our needs with the best solutions he can come up with, making us feel so special ! Tizz is a real gem in the service sector , and I am really happy to be served by him. He is quick witted and earnest in devising the solutions, saving me much time and money, really grateful to him ! Would also like to thank the other staff at the front desk, luggage counter and security desk at the entrance of Novotel, they always greet us with a smile and are always so ready to help ! I think this reflects well on Accor's treatment of staff and the morale it builds amongst them :) kudos ! Am a new fan . ",Novotel Bangkok on Siam Square Hotel,4.0
52,3.0,"Room not very tidy or cleanBed sheet , pillow case are dirty when I check in the roomAfter complained, they changed itToliet basin also not probably clean upNo tooth brush was given, other Accor hotel will provide except BKK",Novotel Bangkok on Siam Square Hotel,4.0
53,5.0,"The staff was wonderful upon check in and during our stay.  Upon Checkin we were assisted by Joy and Toktak, both were delightful. They were able to assist with early check in and late check out in one of our rooms. I love the location of the hotel. Its perfect to get to and from shopping and Skytrain. We will definitely stay there again.",Novotel Bangkok on Siam Square Hotel,4.0
54,5.0,"The staff in here are very nice and the location is good also. Me and my friend are very happy to stay in here, and we are sure we will come back to stay in here again . Staff susi and her training Abigail are very friendly  thanks",Novotel Bangkok on Siam Square Hotel,4.0
